<?xml version="1.0" encoding="UTF-8"?>
<!DOCTYPE Concesionario SYSTEM "Concesionario.dtd">
<Concesionario>
    <coche>
        <codigoDeCoche>IJCLMNJHG89736589</codigoDeCoche>
        <marca>Ferrari</marca>
        <modelo>Ferrari SF90 Stradale</modelo>
        <matricula>7865 ETF</matricula>
        <potencia>1000CV</potencia>
        <plazas>2</plazas>
        <numeroDePuertas>2</numeroDePuertas>
    </coche>
</Concesionario>
   